{
  "eventId": "0d2c0bb3-f4f2-4ec8-8d04-31834258a671",
  "eventType": "user.created",
  "timestamp": "2026-02-16T10:20:00.000Z",
  "version": "v1",
  "source": "auth-service",
  "payload": {
    "userId": "usr_1001",
    "email": "alice@example.com",
    "roles": ["customer"],
    "status": "active",
    "createdAt": "2026-02-16T10:19:59.000Z"
  }
}
